,date,content,replyCount,retweetCount,likeCount,quoteCount
383,2020-07-28,"I keep seeing stupid comments like this. People move to competing companies all the time. Rivian didn't poach anyone, they created a competitive and attractive work environment to bring in talent. If Tesla was so great those people would have stayed there",0,0,4,0
384,2020-07-28,Wasn't it planned to be now?,1,0,0,0
385,2020-07-28,"What about cold weather performance? What about range hits when towing a trailer? Where do I take it for service? When can I test drive one? You seem to have a well thought out product, but there are a lot of questions that need to be answered before I dump my current truck",1,0,1,0
386,2020-07-28,Rivian Releases New R1T Test Video,0,0,0,0
387,2020-07-28,I've seen the specs...I want to see the proof!,1,0,1,0
388,2020-07-28,Rivian R1T Electric Pickup to Start Rolling Out June . (Digital Trends),0,1,3,0
389,2020-07-28,I still never got a response on maintenance for this vehicle ? Where do we take it ?,1,0,0,0
390,2020-07-28,Rivian for sale coming soon on Amazon ?,1,0,1,0
391,2020-07-28,Check out the Rivian truck but you'll have to wait for that too.,0,0,0,0
392,2020-07-28,A Rivian R1S!!,1,0,0,0
393,2020-07-28,Losing a lot of respect for . It seems pretty likely that they did recruit Tesla employees and then encourage them to steal confidential documents and information on their way out. Not cool. $TSLA,0,1,0,0
394,2020-07-28,any ipo?,0,0,0,0
395,2020-07-28,Is there going to be a non-launch-edition interior or will they all be launch edition at launch?,0,0,0,0
396,2020-07-28,ex Tesla employees isn't a conspiracy. It's a horrible retention rate. on glassdoor with a product that exciting? That's almost as bad as some complete trainwrecks I've worked at.,1,0,3,0
397,2020-07-28,"Very interesting , leaves Cali as . Move sound like a liquidity swap to me. Maybe I am just reading to much into it oh and both CEO are people.",0,0,0,0
398,2020-07-28,"Rivian releases new electric pickup test video, explains balance of off-road and on-road performance by fredericlambert (ElectrekCo) July ,",0,0,0,0
399,2020-07-28,"Rivian releases new electric pickup test video, explains balance of off-road and on-road performance by fredericlambert",0,0,0,0
400,2020-07-28,"Because deep down inside, black people don't scare them so much that they'll believe whatever fear-mongering BS Fox and Friends tell them about BLM, which is primarily about putting an end to cops murdering specifically black people for crimes ranging from petty to imaginary.",0,0,2,0
401,2020-07-28,Tow rating of the pickup is lbs.,1,0,0,0
402,2020-07-28,"America's pickup truck goes electric -- Electric trucks are coming from GM, Ford, Tesla and Rivian.",0,0,0,0
403,2020-07-28,"Rivian releases new electric pickup test video, explains balance of off-road and on-road performance",0,0,0,0
404,2020-07-28,". raises $2.5 billion as it pushes to bring its electric pickup, SUV to market. via",0,0,1,0
405,2020-07-28,Rivian is following in VW steps...Disgusting.Disgraceful.Im out,0,0,1,0
406,2020-07-28,New Rivian Video Feature: All About Performance | Electric Adventure Vehicle Development,0,0,0,0
407,2020-07-28,Pandemic Poaching Lessons: vs How to protect your companys top talent and,0,0,0,0
408,2020-07-28,"Rivian releases new electric pickup test video, explains balance of off-road and on-road performance: Rivian has released a new video of their testing program for their R1T electric pickup truck and explained how they are trying to achieve a balance",0,0,0,0
409,2020-07-28,"Rivian releases new electric pickup test video, explains balance of off-road and on-road performance - Rivian has released a new video of their testing program for their R1T electric pickup truck and explained how they are trying to achieve a balance between off-road an...",0,0,0,0
410,2020-07-28,"He's getting into the truck market and has stiff competition from Rivian. He's just trying to sound tough for the F-150 crowd, AKA republicans.",0,0,2,0
411,2020-07-28,"Rivian releases new electric pickup test video, explains balance of off-road and on-road performance",0,1,0,0
412,2020-07-28,"Rivian releases new electric pickup test video, explains balance of off-road and on-road performance",0,0,0,0
413,2020-07-28,"Rivian releases new electric pickup test video, explains balance of off-road and on-road performance by",6,21,65,0
414,2020-07-28,"I'm just waiting for , right ?",0,0,1,0
415,2020-07-28,Tesla Files Lawsuit Against Rivian For Stealing Confidential Records [],0,0,0,0
416,2020-07-28,"Maybe ""Rivian Cheat mode"" T-shirt in merch store",0,0,0,0
417,2020-07-28,What Can You Expect From Your Upcoming Rivian Electric Adventure Vehicle? via .com,0,0,0,0
418,2020-07-28,"What if I have a Taycan, a Rimac and a Ocean? Oh, and a Rivian pickup?",1,0,2,0
419,2020-07-28,I have made my down payment last year for my rivian. Since then I have purchased a Airstream Flying Cloud CB. It is at max. capacity lbs. Im worried about my battery range with such a trailer in tow. What will the range be on the kw/hr battery pack?,0,0,0,0
420,2020-07-28,"Nikola, Fisker, Rivian, and the not named in the article but in the race as well, 's own are all designing / building Semis and trucks to hit to road soon! .",0,0,1,0
421,2020-07-28,Rivian delays electric pickup to summer,0,1,0,0
422,2020-07-28,So proud of Tesla for providing such a great workforce. I'm eager to see who you're going to pitch next.,2,0,0,0
423,2020-07-28,"Man, as an American, I am proud of the work and innovation that is currently taking place on our soil!! $NKLA, $TSLA, $SPAQ, $WHKS, and Rivian just to name a few are going to flip the automotive industry on its head!! Watch Nikolas promo vid bellow.",0,0,0,0
424,2020-07-28,Many new car companies coming in the future! Like just wait!!,0,0,1,0
425,2020-07-28,"Hey, Stephen! We'll be launching a merchandise store later this year. Be on the lookout for announcements!",1,1,9,0
426,2020-07-28,Rivian has a similar sleek lidar too.,0,0,0,0
427,2020-07-28,"Lucid counters Autopilot, Tesla sues Rivian, wartime French EVs: Todays Car News - Tesla sues Rivian over trade secrets. Lucid details its driver-assistance system that could challenge Autopilot. Peugeot built EVs in WW!!. And we catch another glimpse of the next generation o...",0,0,0,0
428,2020-07-28,", Inc AMZN %-backed Rivian will begin deliveries of its all-electric pickup truck and SUV by sumer next year, the electric vehicle maker said in an email on Saturday, as reported by TechCrunch.",0,0,2,0
429,2020-07-28,"Yes! So stoked for deliveries to begin! They will be great vehicles, and very popular!! Intelligent design and on trend. Go !",0,0,0,0
430,2020-07-28,says deliveries of its R1T electric pickup truck will begin in June . Deliveries of the R1S electric SUV will start in August .,0,3,14,0
431,2020-07-28,"If Morris-Commercial can (ostensibly) return from the grave, ANYTHING is possible!",1,0,3,0
432,2020-07-28,"Or put a ""Scout"" badge on a Bollinger!",0,0,2,0
433,2020-07-28,That ev truck ? Workhorse ? Or Rivian ?,1,0,0,0
434,2020-07-28,If you need a driver and a trailer and some horses to test with feel free to come out here! I'd be happy to volunteer,1,0,1,0
435,2020-07-28,Guys: hope you knocked it out of the ball park!!!But please stop pouching talent from . Thanks,2,0,1,0
436,2020-07-28,Just watching CNBS halftime report. They say that Tesla valuation will be diluted by all of the worthy competitors like Nikola and Rivian who will emerge over the next year. Hold me daddy Im scared,0,0,2,0
437,2020-07-28,Gonna die b4 these are actually on the street....zzzzzzzz,0,0,1,0
438,2020-07-28,I'm still waiting to get one of the cool Rivian branded tees!,1,0,2,0
439,2020-07-28,$BB $TSLA QNX going to power EV also $F Ford and Rivian QNX to power autonomy systems in Canoo's next generation electric vehicles,0,0,1,0
440,2020-07-28,"Charged EVs | Guidehouse Insights report identifies Rivian, Nio, and Nikola as leading EV upstarts",0,0,0,0
441,2020-07-28,"We hear you, Matt! Your request has been shared with our teams!",1,0,13,0
442,2020-07-28,We can't wait to get you behind the wheel our an Electric Adventure Vehicle! We appreciate your support.,0,0,3,0
443,2020-07-28,"Lucid counters Autopilot, Tesla sues Rivian, wartime French EVs: Todays Car News",0,0,4,0
444,2020-07-28,Mine will be Lucid Canoo with Rivian a possible rd. Runner up?,1,0,3,0
445,2020-07-28,Looks amazing!! Such a great job team Cant wait to replace our Model with a R1T/R1S,0,0,0,0
446,2020-07-28,Lots of good alternatives coming down the pipe in the next -24 months. I'm particularly intrigued by Rivian and Lucid.,0,0,2,0
447,2020-07-28,"Still haven't seen a video of it pulling a trailer. If it can pull my horses through Colorado, I will be excited beyond words",1,0,8,0
448,2020-07-28,Love the new performance video from . I still want to be convinced that I can pull my horses through Colorado with it.,0,0,0,0
449,2020-07-28,Cant wait to beat mine up!,0,0,2,0
450,2020-07-28,Proper pre-production testing! Thats why I like you guys.. i know that whatever I will be throwing at the R1T/R1S it can take it.. got a Jeep and F150 just itching to be replaced by Rivian.,1,0,1,0
451,2020-07-28,New video of the Rivian R1T!,0,0,1,0
452,2020-07-28,No wonder Elon is bothered by Rivian. Multiple people all jumping ship to there,0,0,1,0
453,2020-07-28,"Last week, we announced that R1T deliveries will begin in June , with R1S following in August. This week, we want to share a little about what you can expect when your Electric Adventure Vehicle arrives. Testing was conducted on a closed course.",45,76,465,21
454,2020-07-28,"ALL New Rivian R1T Rival Tesla CYBERTRUCK - Super Truck Price start $69,000 Rivian is one of the few promising EV makers that's set to launch in the near future. The company's first vehicles will be the R1T electric pickup truck and R1S three-row SUV.",0,0,0,0
455,2020-07-28,"There is clear evidence of wrong-doing, with some defendants confessing to taking materials. It wouldn't take much of an attorney to string it all together in a trial... Rivian's only defense is ""we didn't know, and haven't seen any of it"". I don't think that will stand up.",1,0,1,0
456,2020-07-28,"ALL New Rivian R1T Rival Tesla CYBERTRUCK - Super Truck Price start $69,000",0,0,0,0
457,2020-07-28,"ALL New Rivian R1T Rival Tesla CYBERTRUCK - Super Truck Price start $69,000Rivian is one of the few promising EV makers that's set to launch in the near future. The company's first vehicles will be the R1T electric pickup truck and R1S three-row SUV. W",0,0,0,0
458,2020-07-28,"Tesla sues Rivian over alleged trade-secret theft related to sales, charging network",0,0,0,0
459,2020-07-28,Im not sure the clause ran out. It looks like Tesla is suing Rivian.,1,0,1,0
460,2020-07-28,First person to post their Rivian + Lucid garage on Insta wins,6,0,30,0
461,2020-07-28,Rivian R1T and R1S electric truck and SUV finally being delivered next summer:,0,1,2,0
462,2020-07-28,"This encounter went way different than expected! The bandits didn't expect Rivian Soldiers to show up!In reality, the mage Margaux cast the Journeyman Illusion spell for the first time. The bandits fired volley of xbow bolts and ran!",0,0,1,0
463,2020-07-28,Rivian R1T and R1S electric truck and SUV finally being delivered next summer,0,0,0,0
464,2020-07-28,"Tesla sues Rivian over alleged trade-secret theft related to sales, charging network",0,0,0,0
465,2020-07-28,Time will tell.Rivian also looking great.,0,0,2,0
466,2020-07-28,Tesla sues rival Rivian over alleged data theft scheme,0,0,1,0
467,2020-07-28,"The car's design and looks- dogs love it, Poldo's loving it.Btw, for the Baja version, try to trump the ground clearance of NASA's Perseverance Mars Rover at inches max.",0,0,0,0
468,2020-07-28,"Tesla sues Rivian for allegedly stealing secrets, poaching employees",0,0,0,0
469,2020-07-28,"I'm not yet sure how much of this case is about real theft and how much is about preserving the ""only Tesla can invent things"" myth. I know that Rivian tries to prevent this kind of thing from happening with new hires, but I know that such efforts are not always successful.",0,0,1,0
470,2020-07-28,"Tesla sues Rivian over alleged trade-secret theft related to sales, charging network",0,2,2,1
471,2020-07-28,No doubt the CCP has stolen EVERY secret from from their Shanghai plant &amp; Supercharger network in China. Why is Elonso quiet about this but making a fuss over Rivian. Investors beware!,0,0,1,0
472,2020-07-28,I looked it up. Amazon owns a chunk of an electric truck manufacturer called Rivian. They ordered them from Amazon.,0,0,0,0
473,2020-07-28,Everybody is saving up for either a Tesla Cybertruck or a Rivian SUV,1,0,1,0
474,2020-07-28,is suing over the alleged theft of trade secrets. What do you think of that?,1,0,1,0
475,2020-07-28,"""The gender-neutral shade was inspired by a car that Rihanna saw prior to development""Rivian?",1,2,15,0
476,2020-07-28,Rivian R1T electri...,0,0,0,0
477,2020-07-28,Rivian R1T Electric Pickup to Start Rolling Out June . (Digital Trends),0,0,2,0
478,2020-07-28,Rivian To Start Delivering All-Electric Pickup By Summer Next Year: Report via,0,0,0,0
479,2020-07-28,Rivian - Electric Adventure Vehicle | Fully Charged qua,0,0,0,0
480,2020-07-28,"This week featured deal is Electric vehicle-maker Rivian, raised $2.5 billion of private equity T. Rowe Price and Soros Fund Management etc, brings the companys valuation at least billion. Welcome to follow us on Twitter!",0,0,0,0
481,2020-07-28,Will wraps work for that? Whatever colors customer wants? Without high many choice color options?,1,0,0,0
482,2020-07-28,"It points to the fact, that Rivian isnt as far a long as they have portrayed themselves to be. That they are still very much in their infancy. Further, I *had* huge respect for Rivian... now... not so much. RJ was supposed to be more of a standup guy than this.",0,0,1,0
483,2020-07-28,"Gustavo Biscardi Treasurer Rivian""treasury is sometimes the single source of truth related to cash transaction, cash position, liquidity. We have to build this level of trust with the CFO/CEO where simple communication channel will solve a lot of their",0,0,0,0
484,2020-07-28,"Check it. The Station: Winners and losers in Paris, Rivian sets a delivery date, Waymo and FCA deepen ties via",0,0,1,0
485,2020-07-28,"Tesla, Rivian, Nikola Motor, Mercedes-Benz &amp; many other Global Auto Firms Globally are Already into the Electric Trucks segment too..",0,0,0,0
486,2020-07-28,"Tesla, Rivian, Nikola Motor, Mercedes-Benz &amp; many other Global Auto Firms Globally are Already into the Electric Trucks segment too..",0,0,0,0
487,2020-07-28,"Tesla, Rivian, Nikola Motor, Mercedes-Benz &amp; many other Global Auto Firms Globally are Already into the Electric Trucks segment too..",0,0,0,0
488,2020-07-28,"Tesla, Rivian, Nikola Motor, Mercedes-Benz &amp; many other Global Auto Firms Globally are Already into the Electric Trucks segment too..",0,0,0,0
489,2020-07-28,Tesla says that around people have left Tesla for Rivianincluding in the last four months. And Tesla claims that several of those employees took confidential documents with them on their way out the door.,0,0,0,0
490,2020-07-28,"Guidehouse Insights report identifies Rivian, Nio, and Nikola as leading EV upstarts",0,0,0,0
491,2020-07-28,"The Station: Winners and losers in Paris, Rivian sets a delivery date, Waymo and FCA deepen ties: by TechCrunch",0,0,0,0
492,2020-07-28,Stay away from politics Elon you smarter than that any company that messed with politics didnt end well you got rivian on the other side waiting for you to make a mistake.,0,0,0,0
493,2020-07-28,No they are good for the environment Gaz. And overall produce less co2 than a ice car But I agree never buy a Tesla Buy a rivian honda or fisker or nissan ev instead.,1,0,0,0
494,2020-07-28,In the future I think I want to get an electric car whether that be a or be more eco friendly. Im sure by the time I get a new car they will be around the same price as my Honda Accord.,0,0,0,0
495,2020-07-28,Tesla sues Rivian for allegedly leaking the company's secrets,0,2,1,0
496,2020-07-28,Get a Rivian instead. BONUS it wasnt designed using MS Paint.,0,0,0,0
497,2020-07-28,Bahahahaha is SUIING my fellas! Can't we all just get along! Rivians R1S = + miles w/185kWh battery + HP -60mph seconds! + feet of wading + seater! First round of investments =$2.5Billion from Get your pre-order in!,1,0,3,0
498,2020-07-28,"Rivian R1T, R1S electric vehicle deliveries starting next summer by",0,0,0,0
499,2020-07-28,This isnt true.,0,0,0,0
500,2020-07-28,Not true.,0,0,0,0
501,2020-07-28,Lol. Teslas entire argument is you have ex-tesla employees and they know things about Tesla.Thats not getting caught my dude.,0,0,0,0
502,2020-07-28,Just continues to prove that genius doesn't mean you aren't a dick. so I think I'll grab a,0,0,0,0
503,2020-07-28,Buy etc.,0,0,0,0
504,2020-07-28,Rivian delays electric pickup to summer - Electrek,0,0,0,0
505,2020-07-28,Try . Up and coming EV cars.,0,0,0,0
506,2020-07-28,other EV on the markets are up and coming too. try . Tesla is no longer the only option for green cars.,0,0,0,0
507,2020-07-28,Rivian To Start Delivering All-Electric Pickup By Summer Next Year: Report,0,0,0,0
508,2020-07-28,was thinking bout going electric with tesla... now maybe Rivian... yep if u suport Repubs. im done with u!!!!,0,0,1,0
509,2020-07-28,Got one in Bloomington that might be similar.....Rivian.,0,0,0,0
510,2020-07-28,Thats great that it helps you be a good mentor and Im glad you work with a team that understands. Rivian sounds like an awesome place to work! Id even apply there if I wasnt married to Portland.,0,0,1,0
511,2020-07-28,"Sean, can you discuss the possible cost ramifications for Rivian ?Thank You.",0,0,2,0
512,2020-07-28,"Reading this lawsuit, it seems Tesla has caught Rivian red handed. If this was any other auto manufacturer I would also expect a similar lawsuit. Its just a shame it had to be anothe electric vehicle manufacturer....",0,0,4,0
513,2020-07-28,It would sadden me if Rivian employed ex-Tesla employees that took Tesla's IP with them. Sadden me enough not to buy their products. I will wait for the lawsuit to run its course before being judgemental.,0,0,2,0
514,2020-07-28,"Some of you have been asking for my opinion of the Tesla/Rivian lawsuit. I've struggled with how I feel about it. I'll likely do a short video with some question that are important for all to consider. Meanwhile, you can view the docket here: .",10,6,44,0
515,2020-07-28,do you think Rivian is actually going to start delivering product? Where does that put Tesla's truck?,0,0,0,0
516,2020-07-28,War ls on! Tesla sues Rivian claiming employees stole trade secrets - CNN,0,0,0,0
517,2020-07-28,When are we going public?,0,0,0,0
518,2020-07-28,"The Station: Winners and losers in Paris, Rivian sets a delivery date, Waymo and FCA deepen ties via",0,0,0,0
519,2020-07-28,The guys at Rivian where the ones to give you that. just fucked everyone spending billions of public money on eternally profitless companies,1,0,0,0
520,2020-07-28,"The Station: Winners and losers in Paris, Rivian sets a delivery date, Waymo and FCA deepen ties - TechCrunch",0,0,0,0
521,2020-07-28,Tesla sues Rivian for stealing secrets as electric car fight heats up by - Inspiring Ideas into Action.,0,0,0,0
522,2020-07-28,Rivian delays production until :,0,0,1,0
523,2020-07-28,Rivian To Start Delivering All-Electric Pickup By Summer Next Year: Report for News,0,0,0,0
524,2020-07-27,"Tech | The Station: Winners and losers in Paris, Rivian sets a delivery date, Waymo and FCA deepen ties",0,0,0,0
525,2020-07-27,RIVIAN,0,0,0,0
526,2020-07-27,Rivian reveals delivery dates for all-electric ute and SUV via,0,0,0,0
527,2020-07-27,I'm skeptical of Rivian's hub motor technology in particular,0,0,0,0
528,2020-07-27,"The Station: Winners and losers in Paris, Rivian sets a delivery date, Waymo and FCA deepen ties TechCrunch",0,0,0,0
529,2020-07-27,"The Station: Winners and losers in Paris, Rivian sets a delivery date, Waymo and FCA deepen ties",0,1,0,0
530,2020-07-27,Tesla says that around people have left Tesla for Rivianincluding in the last four months. And Tesla claims that several of those employees took confidential documents with them on their way out the door.,10,13,39,5
531,2020-07-27,Report: Tesla files lawsuit against EV startup Rivian,0,0,0,0
532,2020-07-27,They do look cool - like a Cyber Merc G Wagen. For all of them though - Ill believe it when I see it for sale for real. Kinda like the Ford Bronco that I was supposed to be able to buy or years ago.,0,0,1,0
533,2020-07-27,I like the truck best. The aesthetics are right up my alley.,1,0,1,0
534,2020-07-27,"' make the case for trucks are coming from , , and .'",0,0,0,0
535,2020-07-27,"Electric trucks are coming from GM, Ford, Tesla and Rivian.",20,36,119,9
536,2020-07-27,What no or Cybertruck?,1,0,0,0
537,2020-07-27,What plans do they have for use of the Rivian platform for Ford SUVs?,1,0,1,0
538,2020-07-27,US electric vehicle and clean energy company Tesla has alleged that rival Rivian has shown a disturbing pattern of trade secret theft and that four of its former employees stole confidential information when they left to work for the start-up.,0,0,0,0
539,2020-07-27,"Official lefty here. Bought electric cars and EV plugs for the price of a Tesla. At some point I thought I wanted a Cybertruck but the Rivian will do the trick just fine..Fvck and fvck , get them out of this planet asap.",0,1,1,0
540,2020-07-27,Elon open sourced Tesla's technology to help legacy automakers build EVs faster. Tesla is suing Rivian for stealing employees &amp; trade secrets. Big difference. Just because they open sourced the technology doesn't give Rivian the right to steal the secrets of how they do business.,0,0,7,0
541,2020-07-27,"Gustavo Biscardi, Treasurer, Rivian ""in the Treasury world, we're much more on the global perspective right now than regional. So you can expand whatever network that you had on the regional side and take that globally. I had the opportunity to go throu",0,0,0,0
542,2020-07-27,Rivian should change their name to E-Lon Automotive to show how committed they are to copying Tesla.,0,0,0,0
543,2020-07-27,Good news for Illinois manufacturing.Rivian electric vehicles scheduled to arrive next summer via,0,0,1,0
544,2020-07-27,God knew I couldnt afford the Rivian so they gave me Nissans new electric SUV set to come out in . Now I just need my current car to make it til then.,0,0,0,0
545,2020-07-27,I cant wait for Rivian to go public,0,0,1,0
546,2020-07-27,"Knowledge spillovers in practice: ""Tesla sues Rivian for stealing secrets as electric car fight heats up""",0,0,3,0
547,2020-07-27,"Who's actually making any money at all right now, cut salaries, and put their workers at risk keeping their factory running when the state told them to shut it down for Covid? It's not hard to see how Rivian ended up with ex-Tesla people.",1,0,0,0
548,2020-07-27,Rivian charged for stealing trade secrets of Tesla throughEx-Employees,0,0,2,0
549,2020-07-27,Tesla sues Rivian over alleged unfair competition,0,0,0,0
550,2020-07-27,Well so much for getting a I recommend everyone who is in the market for an electric vehicle consider buying another brand. I recommend,0,0,0,0
551,2020-07-27,"It was great when it all beganI was a regular Elon fanBut it was over when he had the planTo start kissing up to that orange manNow the only thing that gives me hopeIs Rivian, man their truck is DOPETesla go screw yourself you should be the autos for the Klu Klux Klan",3,9,42,1
552,2020-07-27,Hence the reason to buy rather than . That way cant go be weird with your money.,0,0,0,0
553,2020-07-27,But Rivian,0,0,0,0
554,2020-07-27,thoughts on the Tesla - rivian lawsuit?,1,0,0,0
555,2020-07-27,"I'ma be real with ya bro, probably gonna be buying a Rivian truck after all your nonsense",0,0,0,0
556,2020-07-27,Rivian to begin deliveries of electric pickup truck in June . From :,0,0,0,0
557,2020-07-27,Very excited for delivery of my R1S! I already have my high voltage line installed in my garage,0,0,0,0
558,2020-07-27,Rivian's Electric Truck and SUV Arrive Next Summer,0,2,8,0
559,2020-07-27,I just was chatting with someone privately about this and I think this is a good summary of positives and challenges that come with this. Intel crew refers to the ppl I work with. Most of us worked at Intel together and now are back together at Rivian,1,0,0,0
560,2020-07-27,Looks like Im buying a Rivian.,0,0,0,0
561,2020-07-27,"The Station: Winners and losers in Paris, Rivian sets a delivery date, Waymo and FCA deepen ties",0,0,0,0
562,2020-07-27,"The Station: Winners and losers in Paris, Rivian sets a delivery date, Waymo and FCA deepen ties",0,0,0,0
563,2020-07-27,Exposing Rivian's ILLEGAL Plan To Take On Tesla via,0,0,0,0
564,2020-07-27,RIVIAN in a nutshell,0,0,0,0
565,2020-07-27,"It's basically their process of hiring people, their salaries and bonuses, and a few more proprietary documents. These aren't small things, if you've worked at HR you'd know. And I don't see why Rovian won't be tied to it when an employee of Rivian is found with all those files.",1,0,0,0
566,2020-07-27,"The Station: Winners and losers in Paris, Rivian sets a delivery date, Waymo and FCA deepen ties",0,0,0,0
567,2020-07-27,"Nikon Z5 Announcement, Rivian starts factories, and mores... | Tech News via",0,0,1,0
568,2020-07-27,"Rivian didn't cut a single salary. Every factory worker they'd hired up to that point was told to stay home for a month and a half and paid a full salary. They reopened the factory when they felt it safe to do so, weeks after Normal gave them the okay to do it.",1,0,0,0
569,2020-07-27,Volvo should steal Rivian's thunder with a pickup version of the XC90 T8,0,0,0,0
