,date,content,replyCount,retweetCount,likeCount,quoteCount
203,2020-07-30,"NZ EV numbers pick up, Rivian raises $2.5bn, the new Nissan Aria, theres a bhp Ford EV in the wild &amp; Invisible Urban takes interest",0,0,1,0
204,2020-07-30,"NZ EV numbers pick up, Rivian raises $2.5bn, the new Nissan Aria, theres a bhp Ford EV in the wild &amp; Invisible Urban takes interest -",0,0,0,0
205,2020-07-30,"NZ EV numbers pick up, Rivian raises $2.5bn, the new Nissan Aria, theres a bhp Ford EV in the wild &amp; Invisible Urban takes interest -",0,0,0,0
206,2020-07-30,"With around the corner its great to see that the Utility EV space wont be lacking in the next two years. Between Bollinger, Rivian, Tesla, GM and maybe Ford. We tip a fully charged to the future.",0,0,2,0
207,2020-07-30,Considering the lawsuit against Rivian. Is $BLNK movement today a result of a potential partnership between Blink and Rivian?,0,1,0,0
208,2020-07-30,"Lmao I was thinking about the Bronco and the Hummer EV. I think the Rivian drops, too.",1,0,0,0
209,2020-07-29,Well said listen,0,0,1,0
210,2020-07-29,"But as I write in my book, I believe the future belongs to companies that find a way to balance auto manufacturing culture with the software-inspired startup-style culture. Rivian has a lot to prove, but conceptually they seem to be closest to this difficult balancing act.",1,1,0,0
211,2020-07-29,Hope that's a fake and horrible mock up. It looks like a Chinese knockoff of the Rivian R1T.,2,0,12,0
212,2020-07-29,"Normal, IL. Home of State Farm, Rivian and hours from Chicago, St. Louis, and from Indy. Also, Red Lion needs a twin brother to hang with",0,0,0,0
213,2020-07-29,Being fan of city &amp; state is totally different from being fan of VWs/Rivians disingenuous and fraudulent behavior.,1,0,0,0
214,2020-07-29,Wait. I have stock in their parent/partner company $NCTY,0,0,1,0
215,2020-07-29,"NZ EV numbers pick up, Rivian raises $2.5bn, the new Nissan Aria, theres a bhp Ford EV in the wild &amp; Invisible Urban takes interest -",0,0,0,0
216,2020-07-29,"NZ EV numbers pick up, Rivian raises $2.5bn, the new Nissan Aria, theres a bhp Ford EV in the wild &amp; Invisible Urban takes interest -",0,0,0,0
217,2020-07-29,You all are still around?! Sorry but man we all got too focused on and and kinda forgot you were here.,1,0,2,0
218,2020-07-29,The two most exciting EV companies in the world for must be and .Exciting times.,0,0,1,0
219,2020-07-29,is working on a solution to this,0,0,0,0
220,2020-07-29,"NZ EV numbers pick up, Rivian raises $2.5bn, the new Nissan Aria, theres a bhp Ford EV in the wild &amp; Invisible Urban takes interest -",0,0,0,0
221,2020-07-29,The Rivian R1T Being Pushed Hard Off-RoadThe Ford F-150 better watch out.TAG A Friend! RivianR1T,0,0,0,0
222,2020-07-29,I hope the Rivian really does come out as this when in production!,0,0,1,0
223,2020-07-29,"Rivian FSD on special $10,000 buy now with Amazon Prime",0,0,1,0
224,2020-07-29,"( Instagram Link : JeffBezos, George Soros, Robert J. Scaringe, Philippe Laffont &amp; Ron BaronDATE: /10/2020COMPANY: Rivian RivianOfficial INVESTORS: T. Rowe Price, Soros Fund Management, Coatue Management, Fidelity Management and Research,",0,0,2,0
225,2020-07-29,How long before Rivian is for sale on Amazon ?,1,0,0,0
226,2020-07-29,Looks dope! Great work!,0,0,0,0
227,2020-07-29,Hi! What's the timeline for european deliveries? And are there any information on specific countries you are planning to set up sales and service? (I'm especially curious about Norway),0,0,0,0
228,2020-07-29,"What's the market like for $70,000 pickup trucks? Compared to something like a Toyota Landcruiser, most people don't even take those off-road until they have about miles on them.",0,0,0,0
229,2020-07-29,Watch The Rivian R1T Being Pushed Hard Off-Road. The F-150 better watch out. Read:,0,1,0,0
230,2020-07-29,What would it cost + ? . Rivian or Cybertruck will be the better choice,0,0,0,0
231,2020-07-29,"I would imagine, they're copying Rivian, but wanted to rename the tank turn as ""crab mode""?",0,0,3,0
232,2020-07-29,"I just find it strange that Jeff Bezos tries to compete with Elon on ALL FRONTS. Rivian vs Tesla, Blue Origin vs SpaceX, Zoox vs Autopilot, Kuiper vs Starlink. It's like he has a crush on him or something...its just WEIRD!!!",0,1,1,0
233,2020-07-29,"NZ EV numbers pick up, Rivian raises $2.5bn, the new Nissan Aria, theres a bhp Ford EV in the wild &amp; Invisible Urban takes interest -",0,0,0,0
234,2020-07-29,"NZ EV numbers pick up, Rivian raises $2.5bn, the new Nissan Aria, theres a bhp Ford EV in the wild &amp; Invisible Urban takes interest",0,0,0,0
235,2020-07-29,"Anyone else wondering why there are so many disgrunteled Tesla employees?Tesla sues Rivian for allegedly stealing secrets, poaching employees",0,0,0,0
236,2020-07-29,"NZ EV numbers pick up, Rivian raises $2.5bn, the new Nissan Aria, theres a bhp Ford EV in the wild &amp; Invisible Urban takes interest -",0,0,0,0
237,2020-07-29,"Rivian are getting closer to launch.If the folks at JLR aren't all over this already, they should be...",2,0,5,0
238,2020-07-29,Thinking this will be a cross between Rivian and Bollinger.,0,0,0,0
239,2020-07-29,The R1T Is All About Performance - Motor Illustrated,0,0,0,0
240,2020-07-29,First vehicle will be delivered soon in........................................................,1,0,0,0
241,2020-07-29,Cant have a meaningful conversation about the forthcoming wave of electric pickup trucks and SUVs without even mentioning,0,0,0,0
242,2020-07-29,i know how to get an unlimited mileage per charge EV. in less than hours i can make your engineers kick themselves. I've got some family ties to the manhattan project. you should take a look at how many Runge's have been physicists/chemists. i found the ebola vaccine,0,0,0,0
243,2020-07-29,"Rivian releases new electric pickup test video, explains balance of off-road and on-road performance - Electrek",0,0,0,0
244,2020-07-29,"FCA is the only brand that could use the tech to jump ahead of so many others, unless PSA blocks it. GM and Honda are tied together, Ford and Rivian, and now Toyota is readying their solid state tech.Given FCA and Tesla's history in Europe, it's a no-brainer shortcut!",1,0,1,0
245,2020-07-29,"I forgot, I see tons of Rivian products on the street &amp; their charging network is awesome, that OS gets rave reviews in people magazine",0,0,1,0
246,2020-07-29,So why is Tesla suing Rivian and Xpeng?,0,0,0,0
247,2020-07-29,I have a dream One day my garage will just be full of Evs Yes I have a dream,0,0,1,0
248,2020-07-29,Ford's already fine thanks to the collaboration with Rivian,2,0,0,0
249,2020-07-29,"This week on , we check out the featuring , , , , and .",0,0,1,0
250,2020-07-29,"Rivian releases new electric pickup test video, explains balance of off-road and on-road performance",0,1,1,0
251,2020-07-29,Curious... $gm may have completed a full after years... and is in the midst of a new uptrending cycle... and $clf is intertwined in the cycle...,0,0,0,0
252,2020-07-29,wants to be a Rivian R1T when it grows up,0,0,0,0
253,2020-07-29,"Its obvious that you havent checked out my tweet regularity.. I dont engage on twitter much.. I just follow those accounts I am interested in, mainly Rivian and Porsche .. of which I am both current/future buyer/owner. Have a good day",1,0,0,0
254,2020-07-29,Rivian looking at this like,0,0,1,0
255,2020-07-29,What about a true blue x4 Rivian' esque Safari?,0,0,0,0
256,2020-07-29,"Electric truck hopeful Rivian moving more of its workforce to CaliforniaRivian plans to move much of its Michigan workforce to Irvine, California, and to Normal, Illinois, where the electric trucks will be made.",0,0,0,0
257,2020-07-29,Go and dump,0,0,0,0
258,2020-07-29,"Oh my yes! They tell us everything they are going to do, CAD drawings vertical integration, outsourcing it all. Some have concept cars/trucks. The problem it most often doesnt go past those stages. Some may make a few for production but their heart doesnt seem to be in it.",0,0,0,0
259,2020-07-29,"I could for sure order those companies in terms of success probability. Yes, Lucid and Rivian would be at the top but I don't think Nikola would be at the bottom.But there is a difference from that to the snake oil salesman stamp people are putting on Trevor",1,0,0,0
260,2020-07-29,"Not as much a skeptic of Rivian or Lucid, they have put real work in. Making prototypes is easy. Translating one to production is not. One has to *design for production*. I am not seeing anything reassuring from Nikola.",1,0,0,0
261,2020-07-29,You got it! Thanks for letting us know.,0,0,1,0
262,2020-07-29,"You hear that , , , , , , and others. No need to steel stuff from . They're willing to license it to you. Better take advantage of this opp before it goes away and you become obsolete.",0,0,1,0
263,2020-07-29,Thanks for the response!!!! I was waiting for a bit on my Instagram messenger,1,0,0,0
264,2020-07-29,If Rivian wants Teslas's tech they should buy it nkt steal it.,1,0,1,0
265,2020-07-29,"/ We plan to meet the pledge, in part, by purchasing electric delivery vans from Riviana Michigan-based producer of electric vehicles. Amazon aims to have of Rivians new electric vans on the road as early as , and all vehicles on the road by .",1,0,0,0
266,2020-07-29,"Rivian is to busy worrying about the lawsuits from Tesla for Tesla's ex employees absconding with trade secrets, of which some have admitted to already.",0,0,1,0
267,2020-07-29,"EVs could be an agent of change for car dealers. Many well-known global brands like Volvo and Volkswagen, along with electric startups like Lucid Motors and Rivian, are following Tesla's dealership model.Learn more:",0,1,7,0
268,2020-07-29,"Does anyone actually do anything that tell us what they plan to do one day? At least , and dont feel the need to do this.",2,0,2,0
269,2020-07-29,"It puts it in between the Tesla Model S and Model /Y, and the Rivian R1T/R1S. First vehicles will always cost the most and as they grow/gain capital, more less expensive cars come out. Tesla working on a new compact global car that will put the price around $20k.",0,0,0,0
270,2020-07-29,One of the first fully electric pickups from is on the way after raising almost $3 billion in investments. The company plans to bring a model to market by early . via,0,0,10,0
271,2020-07-29,"Hey! We want to overdeliver for our customers when it comes to service. We are benchmarking the best programs in the industry and owe it to you to sweat the details. Later this year, closer to configuration, well release all the specifics of our program.",1,0,4,0
272,2020-07-29,Go Rivian go!,0,0,0,0
273,2020-07-29,"Rivian releases new electric pickup test video, explains balance of off-road and on-road performance - Electrek",0,0,0,0
274,2020-07-29,We're glad you enjoyed the video. Thank you for the kind words and support! We can't wait to share more in the near future.,0,0,1,0
275,2020-07-29,Hi Alex! That's a great question. Safety is a top priority for us. We'll be announcing the details of our test drive program closer to the start of production with these factors in mind!,0,1,2,0
276,2020-07-29,"Reading: + : ""[T]hey are going to be a lot cheaper to operate on a daily basis than gasoline and diesel trucks."" Rivian releases new electric pickup test video... via",1,1,0,0
277,2020-07-29,Rivian CEO is also not parading around saying theyve changed the industry. Theyre quietly working behind the scenes on a product thatll be out next year.,1,0,1,0
278,2020-07-29,Have you even studied the case?? Will be hard pressed if Tesla is going to lose this case! Rivian already admitted it's guilt in court! It's not OK to steal stuff!!,0,0,0,0
279,2020-07-29,"Rivian releases new electric pickup test video, explains balance of off-road and on-road performance via",0,0,0,0
280,2020-07-29,Amazon has invested in Rivian. Why do you suppose they didn't order from Tesla?,0,0,1,0
281,2020-07-29,If rivian could have legally acquired the ip by paying Tesla they probably would have done it,0,0,0,0
282,2020-07-29,While banking on Rivian?,1,0,0,0
283,2020-07-29,"DID NOT BUY ONE THE FIRST TIME!! I went w/ a Mitsubishi Outlander PHEV - best selling plugin suv in Europe since . Next year, Ill buy a Rivian or anything other than a Tesla. Thanks for advancing the IDEA of alternative fuel vehicles, Elon. Well done! Please now, Shhhh",0,0,0,0
284,2020-07-29,"On GM call, Adam Jonas of MS asked why not change name of Company, to maybe Ultium, the name of its battery pack technology - as way you gain some of investor fervor for",1,0,8,1
285,2020-07-29,"Rivian releases new electric pickup test video, explains balance of off-road and on-road performance",0,0,0,0
286,2020-07-29,Rivian reveals delivery dates for all-electric ute and SUV,0,0,4,0
287,2020-07-29,Why do you think they're suing Rivian right now? Because an HR person tried to take some templates with them or because Rivian has hired former Tesla employees?,0,0,0,0
288,2020-07-29,"My hope is that Rivian &amp; Ford roll out their own Supercharger-like network which I believe is called Fastor Charge. But the easier thing for them to do is just ignore the need for their own dedicated network and rely on rd party chargers, which is sadly the usual attitude.",0,0,1,0
289,2020-07-29,True. Thats what Im thinking. How is Rivian gonnna get access to all those charges? Are they gonna build their own network or just use the existing networks like charge point?,1,0,0,0
290,2020-07-29,"I am as much a skeptic of Nikola as I am of Rivian, Sono, Lucid, Lightyear, Faraday, Fisker...Sure we can pick different holes in all of them them and that is fine, but Nikola has been targeted by Teslafans because of a) the lawsuit agains Tesla and b) Trevor talking.",1,0,0,0
291,2020-07-29,The R1T is looking good! Who wants one?,0,1,0,0
292,2020-07-29,I haven't seen more than some prototypes from Rivian either. Same thing.,1,0,0,0
293,2020-07-29,Rivian,1,0,0,0
294,2020-07-29,Good question. The brief is about Tesla employees grabbing docs on the way out. Ranging from a guy grabbing a contact list of his colleagues from email to one serious theft. They make only one connection to Rivian saying they needed certain types of HR docs. Job description?,0,0,1,0
295,2020-07-29,So when I owned multiple GM vehicles was I in a cult? Does it throw a wrench in your theory I also plan on buying a to replace my truck? Please remove me from your tweet.,0,0,0,0
296,2020-07-29,Confidence is not. Overconfidence might be. Dishonesty surely it is.Let's not compare Nikola against Tesla for once but against Rivian and see which of the two have a real product. Just saying...,1,0,1,0
297,2020-07-29,I think Rivian and Lucid &amp; NIO are the only serious ones,0,0,1,0
298,2020-07-29,Here Are the Latest Updates on the Battery-Powered Pickup Segment - via,0,0,0,0
299,2020-07-29,"Yeah! 'We' never hated Rivian, Nio, Faraday Future, Lucid, Byton, Fisker and numerous others.",1,0,1,0
300,2020-07-29,"Tesla Files Lawsuit Against Rivian For Stealing Confidential Records - , and from",0,0,0,0
301,2020-07-29,"Looks is going to have some serious competition in the pickup truck market. looks like a great product and their factory in Illinois looks ready to roll, delivering trucks by next summer. Can't hardly wait until they get tested side-by-side.",0,0,0,0
302,2020-07-29,"That's... exactly what Tesla is doing. ""Elon just wanted harassment to new startup"" is just as weak as ""billionaire bad"" dude. Rivian's years old. They just abandoned their first concept (a sports car like the OG Roadster) so they had to reset for the R1T and R1S.",0,0,1,0
303,2020-07-29,"If and are able to capture the truck market, big auto will no longer have a safe haven in the truck market.",0,1,2,0
304,2020-07-29,"Everyone Loves EVs, Except the Public",0,1,0,1
305,2020-07-29,"Let court decide then, it is pointless to say Tesla is suffocating Rivian.",0,0,3,0
306,2020-07-29,"Tesla has filed a lawsuit against rival electric automaker Rivian and four former employers, on allegations of poaching talent and stealing trade secrets. Rivian has become the latest company to be sued by Tesla.",0,3,3,0
307,2020-07-29,Get a Rivian. Itll actually ship.,1,0,1,0
308,2020-07-29,"Elon Musk says Tesla is open to licensing Autopilot, supplying powertrains and batteries to other automakers",0,0,1,0
309,2020-07-29,a tiny bit of advice to all of those leaving Tesla for Rivian with pendrives and Gmails full of PDFs:,0,0,0,0
310,2020-07-29,"Green Car Reports: Lucid counters Autopilot, Tesla sues Rivian, wartime French EVs: Today's Car News.",0,0,0,0
311,2020-07-29,He is just telling what allegations did tesla put on Rivian,0,0,2,0
312,2020-07-29,Not sure why they sued Rivian if they are so open about everything.,0,0,0,0
313,2020-07-29,"releases new pickup test video, explains balance of off-road and on-road performance | updated their production timeline for the electric pickup and electric SUV. The first deliveries have been delayed to summer .",0,0,0,0
314,2020-07-29,Let court to decide weather Rivian stole anything or Elon just wanted harassment to new startup,6,0,1,0
315,2020-07-29,EU preorder / delivery date available now?Or isn't EU gonna happen at all?,0,0,0,0
316,2020-07-29,Correction rivian is obviously interested in the supercharger,1,0,3,0
317,2020-07-29,The Rivian suit alleges that the theft involves Teslas hiring and training systems and processes (to name a few). Thats way far from sharing batteries and powertrains as a supplier bud.,1,0,21,0
318,2020-07-29,"Well, stealing is bad. Tell Rivian that.",0,0,2,0
319,2020-07-29,California complaint calls for destruction of Tesla information that the company claims was obtained illicitly; Rivian calls litigation baseless,0,0,1,0
320,2020-07-29,of the four options on offer BMW. Rationale - Hyundai - developed their own platform along with KiaFord - working with RivianVW - developed their own platformBMW - currently in denial and by the time they realise they'll be desperate to partner with *anyone* to stay alive,1,1,4,0
321,2020-07-29,Well its proven that some have downloaded tesla documents after sending them to themselves before quitting and moving to Rivian,2,0,1,0
322,2020-07-29,Same time Suing Rivian to suffocate other EV's growth,7,0,12,0
323,2020-07-29,Cualification is necessary but you need leadership and MOST important CREATIVITY...Elon got both thats why he revolutioned car/space industries.Rivian is yet to deliver a single car to a customer.,0,0,4,0
324,2020-07-29,"I think that's a risk anyway. If it's Samsung at am and Rivian at midday, how many people go to the other end of the exhibition centre for a start up showing its new tech at :30? If anything, not having to physically walk between them might be an advantage.",0,0,1,0
325,2020-07-29,This is why Rivian steals knowledge fron Tesla?,0,0,1,0
326,2020-07-29,Rivian to begin deliveries of electric pickup truck in June,0,0,0,0
327,2020-07-29,What Can You Expect From Your Upcoming Rivian Electric Adventure Vehicle?,0,2,0,0
328,2020-07-29,Why the Rivian lawsuit then?,0,0,0,0
329,2020-07-29,| Electric bakkie battle: Tesla is taking Rivian to courtThis article appeared first on,0,0,0,0
330,2020-07-29,| Electric bakkie battle: Tesla is taking Rivian to courtThis article appeared first on,0,0,0,0
331,2020-07-29,"Lets make NOT bombs. Used To Be Big, Actually, It Was Very Big. But Thanks To Energy Security Is Not Only About Oil Anymore. $TSLA $LIT",0,3,4,0
332,2020-07-29,"Didnt they sue Xpeng too? They dont seem like a big deal, but still sued - Rivian is cool, but I think they have a very very difficult road ahead of them",0,0,0,0
333,2020-07-29,"...our deliveries would have been sooner if we didnt fallow in VW steps...No thank you, Im out.",0,0,0,0
334,2020-07-29,"Rivian trolls Nikola by testing their pickup in Coolidge, AZ on the field where the new NKLA plant will eventually be built.",6,3,64,1
335,2020-07-29,Unless Rivian.,0,0,2,0
336,2020-07-29,At least make few vehicles available to Automotive Media and Social Media Influencers by late .,0,0,0,0
337,2020-07-29,Love your work please put a right hand drive version top of your list for export to Australia. And when can we see a ID3 better?,0,0,0,0
338,2020-07-29,Yea trailer is going to be a growing concern with cybertruck modelY but then also rivian and if Fords F150 makes it into production that too. A pad will make charging standard and make EVs even further adopted.,0,0,1,0
339,2020-07-29,"I do not see ford joining in, they may go with rivian if needed as they are stake holder there",1,0,1,0
340,2020-07-29,Let court to decide weather Rivian stole anything or Elon just wanted to harassment,1,0,1,0
341,2020-07-29,"last I recall, and correct me if I'm wrong, you were going to get a Rivian. Did the lawsuit and delay of delivery change your outlook?",0,0,0,0
342,2020-07-29,No clue. Rivian gotta deliver the product. Just interesting. Stay tuned.,1,0,1,0
343,2020-07-29,Yeah rivian is crying in the corner now,0,0,0,0
344,2020-07-29,"Manager of Policy Communications, Rivian -",0,0,0,0
345,2020-07-29,"It was not enough Tesla interfered with many many contracts I had for my LLC including a position as a chief engineer for a brilliant autopilot startup,recently Tesla put his nasty trolls to trash of me when I expressed my opinion of how great Rivian it is:k10 and Omar enjoy it",0,0,1,0
346,2020-07-29,"Been wondering how test-drives will work with COVID likely to be lingering for some time. Will they be by region and we'd have to come to a location, or perhaps scheduled -on-1's at a location closer to the customer?",1,0,1,0
347,2020-07-29,Nikola would agree. Rivian would disagree. Let's see what happens.,1,0,0,0
348,2020-07-29,Looking forward to your team bringing more manufacturing back to Illinoizzzzzzz!,0,0,4,0
349,2020-07-29,"If you can give me the same range for the same price, you have my money. hasnt built any more Superchargers in Western Australia since the single one they built in , so there isnt a Supercharging network as a reason to buy a Cybertruck over an R1S.",1,0,3,0
350,2020-07-29,Because Rivian stole internal Tesla documents and stuff like that.,0,0,6,0
351,2020-07-29,I don't think you have a choice,1,0,3,0
352,2020-07-29,Super confused where Tesla draws the line on this especially with the rivian IP lawsuits,4,0,0,0
353,2020-07-29,"Pulling for Rivian to do well, love that its in Normal! Stupid..commonplace that NDA is violated...just usually not in the manner this seems to have secrets arent usually casually stolen by sending yourself emails using the company email and server..lol.",0,0,0,0
354,2020-07-29,"What Rivian did was mind-numbingly, flagrantly stupid. Because of Elon and their shared mission they will likely get off a lot better than if this was,say, Ford poaching and stealing from GM. But they do deserve to get slapped lol. Still a huge fan of my hometown EV company LOL",1,0,0,0
355,2020-07-29,Tesla opened up their drivetrain patents for other EV manufacturers to use. What Rivian did is poach Tesla employees and ask them to sneak out sensitive company into before they left. Go to the min mark here (or watch it all - these guys are great!),1,0,1,0
356,2020-07-29,"Very much applaud this response and believe in the mission, but you guys are currently sueing , whos about to be a hot competitor.",0,0,0,0
357,2020-07-29,Why he sued Rivian is he doesnt want to crush competition??,1,0,5,0
358,2020-07-29,I want to support you but youre just not racist enough.-Joe Esposito,0,0,0,0
359,2020-07-29,Please work with Rivian and help solve this lawsuit mess (that is admittedly their fault). They're far and away the most compelling EV manufacturer outside of Tesla and their success is critical to the mission.,1,0,4,0
360,2020-07-29,Because this is not a fucking political issue but a human right!,0,0,0,0
361,2020-07-29,Nice presentation!,0,0,0,0
362,2020-07-29,Using the tech for free vs. paying for licensing fees.,0,0,0,0
363,2020-07-29,but not to rivian i guess. lol,0,0,0,0
364,2020-07-29,"/3(scroll up)Pray, hope &amp; fast for my endeavors.God bless, Stay safe.",0,0,1,0
365,2020-07-29,"Nah the Rivian CEO has a PhD in mechanical engineering. He's the most well-qualified, researched, prepared EV leader I've seen by a long shot.",13,0,17,0
366,2020-07-29,Then why are you suing Rivian?,0,0,0,0
367,2020-07-29,Probably Rivian,1,0,0,0
368,2020-07-29,Is it me or does the new resemble the R1T &amp; R1S? I mean - I love all three!,0,0,0,0
369,2020-07-29,All youll need is,0,0,0,0
370,2020-07-29,Paying to use a technology or a lawsuit?,1,0,0,0
371,2020-07-29,Not if its free.....,1,0,2,0
372,2020-07-29,So no need for to steal info then.,1,0,1,0
373,2020-07-29,What about the issue with Rivian?,0,0,0,0
374,2020-07-29,Notice the background. Rivian for sale on Amazon ?,0,0,1,0
375,2020-07-29,This is awesome! The people in video seem like really genuine and good people. Keep up the good work and cant wait to see these trucks on the road,1,0,2,0
376,2020-07-29,"Rivian releases new electric pickup test video, explains balance of off-road and on-road performance",0,1,0,0
377,2020-07-28,Will Amazon offer FSD for Rivian ?,0,0,1,0
378,2020-07-28,Sound like about the educated response you'd expect from someone complaining about BLM.,0,0,0,0
379,2020-07-28,Hey! We'd love to answer all of your questions. Feel free to send us a DM or an email (info.com)!,1,0,1,0
380,2020-07-28,Fair enough. I had been wondering about where the actual hitch goes. Also what the heck are those buckle-looking things on the inside of the door?,0,0,1,0
381,2020-07-28,"Lucid counters Autopilot, Tesla sues Rivian, wartime French EVs: Toda..",0,0,0,0
382,2020-07-28,Rivian EV Truck Is Delayed Until June - Which Electric Truck Will Come to the Market First? (TFL Talkin' Trucks Podcast Ep.21) -,3,1,9,0
